{
  "$schema": "http://json-schema.org/draft-07/schema#",
  "$id": "coderso.smoke-evidence-checkpoint@v1",
  "title": "Smoke evidence resume checkpoint v1",
  "description": "Strict phase-1 resume-checkpoint.json control file beside the manifest, mirroring the TASK-545 checkpoint contract. Contains only safe identity/integrity metadata: never file bodies, command output, environment values, or agent payloads. The runtime writer/verifier is owned by the TASK-545 closure leaf; this schema pins the declarative shape for owner review and force-track.",
  "type": "object",
  "additionalProperties": false,
  "required": ["schemaVersion", "taskId", "suiteId", "profile", "session", "runId", "workflowEntry", "evidenceDirectory", "manifestSha256", "evidenceFiles", "frozenRuntime", "closureContract", "phase1"],
  "properties": {
    "schemaVersion": { "const": 1 },
    "taskId": { "type": "string", "pattern": "^(TASK-[0-9]{3}|TASK-9999)$" },
    "suiteId": { "type": "string", "pattern": "^[a-z0-9]+(?:-[a-z0-9]+)*$", "maxLength": 128 },
    "profile": { "enum": ["fast", "certification"] },
    "session": { "type": "string", "pattern": "^[a-z][a-z0-9-]{2,63}$" },
    "runId": { "type": "string", "minLength": 1, "maxLength": 200 },
    "workflowEntry": { "type": "string", "pattern": "^_docs/_workflows/task-(?:[0-9]{3}|9999)-(author-audit|implement|fix)\\.mjs$" },
    "evidenceDirectory": { "type": "string", "pattern": "^_docs/_workflows/_smoke/evidence/task-[0-9]{3}/" },
    "manifestSha256": { "type": "string", "pattern": "^[0-9a-f]{64}$" },
    "evidenceFiles": {
      "type": "array",
      "minItems": 2,
      "maxItems": 1024,
      "items": {
        "type": "object",
        "additionalProperties": false,
        "required": ["path", "sha256"],
        "properties": {
          "path": { "type": "string", "maxLength": 2048 },
          "sha256": { "type": "string", "pattern": "^[0-9a-f]{64}$" }
        }
      }
    },
    "frozenRuntime": {
      "type": "object",
      "additionalProperties": false,
      "required": ["gitHead", "workingTreeDirty", "workingTreeSha256"],
      "properties": {
        "gitHead": { "type": "string", "pattern": "^[0-9a-f]{40}$" },
        "workingTreeDirty": { "type": "boolean" },
        "workingTreeSha256": { "type": "string", "pattern": "^[0-9a-f]{64}$" }
      }
    },
    "closureContract": {
      "type": "object",
      "additionalProperties": false,
      "required": ["taskFiles", "supplementalTaskFiles", "taskIndex", "changelogIndex", "changelogNumber", "changelogSlug"],
      "properties": {
        "taskFiles": { "type": "array", "items": { "type": "string", "maxLength": 2048 } },
        "supplementalTaskFiles": { "type": "array", "items": { "type": "string", "maxLength": 2048 } },
        "taskIndex": { "const": "_docs/_TASKS/README.md" },
        "changelogIndex": { "const": "_docs/_CHANGELOG/README.md" },
        "changelogNumber": { "type": "integer", "minimum": 1 },
        "changelogSlug": { "type": "string", "pattern": "^[a-z0-9]+(?:-[a-z0-9]+)*$", "maxLength": 120 }
      }
    },
    "phase1": {
      "type": "object",
      "additionalProperties": false,
      "required": ["state", "generatedAt"],
      "properties": {
        "state": { "const": "owner_review_required" },
        "generatedAt": { "type": "string", "pattern": "^\\d{4}-\\d{2}-\\d{2}T\\d{2}:\\d{2}:\\d{2}(?:\\.\\d{1,9})?Z$" }
      }
    }
  }
}
