{
  "schemaVersion": 1,
  "taskId": "TASK-545",
  "suiteId": "task-545",
  "profile": "certification",
  "session": "task-545-certification",
  "runId": "1111111111111111111111111111111111111111111111111111111111111111",
  "workflowEntry": "_docs/_workflows/task-545-implement.mjs",
  "evidenceDirectory": "_docs/_workflows/_smoke/evidence/task-545/task-545-certification",
  "manifestSha256": "2222222222222222222222222222222222222222222222222222222222222222",
  "evidenceFiles": [
    { "path": "admin-dark-narrow.png", "sha256": "3333333333333333333333333333333333333333333333333333333333333333" },
    { "path": "admin-form-focus.png", "sha256": "4444444444444444444444444444444444444444444444444444444444444444" },
    { "path": "admin-light-wide.png", "sha256": "5555555555555555555555555555555555555555555555555555555555555555" },
    { "path": "admin-menu-open.png", "sha256": "6666666666666666666666666666666666666666666666666666666666666666" },
    { "path": "manifest.json", "sha256": "7777777777777777777777777777777777777777777777777777777777777777" },
    { "path": "public-mobile-nav.png", "sha256": "8888888888888888888888888888888888888888888888888888888888888888" },
    { "path": "report.json", "sha256": "9999999999999999999999999999999999999999999999999999999999999999" }
  ],
  "frozenRuntime": {
    "gitHead": "aaaaaaaaaaaaaaaaaaaaaaaaaaaaaaaaaaaaaaaa",
    "workingTreeDirty": false,
    "workingTreeSha256": "bbbbbbbbbbbbbbbbbbbbbbbbbbbbbbbbbbbbbbbbbbbbbbbbbbbbbbbbbbbbbbbb"
  },
  "closureContract": {
    "taskFiles": [
      "_docs/_TASKS/TASK-545-01-All-Results-Guard-And-Static-Workflow-Contract.md",
      "_docs/_TASKS/TASK-545-01-L01-Add-Require-All-Results-Helper.md",
      "_docs/_TASKS/TASK-545_Workflow_Smoke_Evidence_and_Task_Graph_Integrity.md"
    ],
    "supplementalTaskFiles": [],
    "taskIndex": "_docs/_TASKS/README.md",
    "changelogIndex": "_docs/_CHANGELOG/README.md",
    "changelogNumber": 1257,
    "changelogSlug": "task-545-smoke-evidence-checkpoint"
  },
  "phase1": {
    "state": "owner_review_required",
    "generatedAt": "2026-08-14T00:00:00.000Z"
  }
}
